<?xml version="1.0"?>

<KeyMap Version="1.0.0" xmlns:xsi="http://www.w3.org/2001/XMLSchema-instance" xsi:noNamespaceSchemaLocation="Keymap.xsd">
    <Group Name="Application">
        <Shortcut Name="RenameItem" ActionId="actions.general.RenameItem" Description="Rename the thing">
            <KeyStroke Key="F2"/>
        </Shortcut>
        <Shortcut Name="RenameItem2" ActionId="actions.general.RenameItem" Description="Rename the thing">
            <KeyStroke Mods="CTRL" Key="R"/>
        </Shortcut>
        <Group Name="Editor">
            <Group Name="ViewPort">
                <Shortcut Name="TogglePlayPause" ActionId="actions.editor.timeline.TogglePlayPause">
                    <KeyStroke Key="Space"/>
                </Shortcut>
            </Group>
            <Shortcut Name="ToggleAutomationActive">
                <KeyStroke Key="NumPad0"/>
            </Shortcut>

			<!-- ################################## things #################################### -->
			<InputState Name="UseState1" UseGroupAsManager="true" CanToggle="true">
				<InputState.ActivationKeyStroke Key="D1"/>
			</InputState>
            <InputState Name="UseState2" UseGroupAsManager="true">
                <InputState.ActivationKeyStroke Key="D2"/>
            </InputState>
            <InputState Name="UseState3" UseGroupAsManager="true">
                <InputState.ActivationKeyStroke Key="D3"/>
            </InputState>
            <InputState Name="UseState4" UseGroupAsManager="true">
                <InputState.ActivationKeyStroke Key="D4"/>
            </InputState>

			<Shortcut Name="SaveProject" ActionId="actions.project.Save">
                <KeyStroke Mods="CTRL" Key="S"/>
            </Shortcut>
            <Shortcut Name="SaveProjectAs" ActionId="actions.project.SaveAs">
                <KeyStroke Mods="CTRL+SHIFT" Key="S"/>
            </Shortcut>
            <Shortcut Name="OpenProject" ActionId="actions.project.Open">
                <KeyStroke Mods="CTRL" Key="O"/>
            </Shortcut>
            <Shortcut Name="UndoShortcut" ActionId="actions.project.history.Undo">
                <KeyStroke Mods="CTRL" Key="Z"/>
            </Shortcut>
            <Shortcut Name="RedoShortcut1" ActionId="actions.project.history.Redo">
                <KeyStroke Mods="CTRL+SHIFT" Key="Z"/>
            </Shortcut>
            <Shortcut Name="RedoShortcut2" ActionId="actions.project.history.Redo">
                <KeyStroke Mods="CTRL" Key="Y"/>
            </Shortcut>

            <!-- ################################## Automation helper shortcuts #################################### -->
            <Shortcut Name="EnableAutomation" ActionId="actions.app.EnableAutomationShortcuts">
                <KeyStroke Mods="CTRL" Key="NumPad0"/>
            </Shortcut>
            <Shortcut Name="SelectPrevParameter" ActionId="actions.automation.SelectPreviousParameterAction">
                <KeyStroke Mods="CTRL" Key="NumPad2"/>
            </Shortcut>
            <Shortcut Name="SelectNextParameter" ActionId="actions.automation.SelectNextParameterAction">
                <KeyStroke Mods="CTRL" Key="NumPad8"/>
            </Shortcut>
            <!-- ################################################################################################### -->

            <Group Name="Resources">
                <Shortcut Name="DeleteItems" ActionId="actions.resources.DeleteItems" Description="Deletes all of the selected resources">
                    <KeyStroke Key="Delete"/>
                </Shortcut>
                <Shortcut Name="GroupSelection" ActionId="actions.resources.GroupSelection" Description="Puts the selected items into their own group">
                    <KeyStroke Mods="CTRL" Key="G"/>
                </Shortcut>
            </Group>
            <Group Name="Timeline">
                <Group Name="Surface">
                    <Shortcut Name="DeleteSelectedClips" ActionId="actions.editor.timeline.DeleteSelectedClips" Description="Deletes all of the selected clips">
                        <KeyStroke Key="Delete"/>
                    </Shortcut>
                    <Shortcut Name="SliceClipsAction" ActionId="actions.editor.timeline.SliceClips" Description="Cuts the selected clip in half where the play head is. If you have no selection, then all clips over the play head are sliced">
                        <KeyStroke Key="S"/>
                    </Shortcut>

                    <Shortcut Name="MoveBack" ActionId="actions.timeline.surface.MoveBack">
                        <KeyStroke Key="Left"/>
                    </Shortcut>
                    <Shortcut Name="MoveForward" ActionId="actions.timeline.surface.MoveForward">
                        <KeyStroke Key="Right"/>
                    </Shortcut>
                    <Shortcut Name="ExpandEndBackwards" ActionId="actions.timeline.surface.ExpandEndBackwards">
                        <KeyStroke Mods="SHIFT" Key="Left"/>
                    </Shortcut>
                    <Shortcut Name="ExpandEndForward" ActionId="actions.timeline.surface.ExpandEndForward">
                        <KeyStroke Mods="SHIFT" Key="Right"/>
                    </Shortcut>
                    <Shortcut Name="ExpandBeginBack" ActionId="actions.timeline.surface.ExpandBeginBack">
                        <KeyStroke Mods="CTRL+SHIFT" Key="Left"/>
                    </Shortcut>
                    <Shortcut Name="ExpandBeginForward" ActionId="actions.timeline.surface.ExpandBeginForward">
                        <KeyStroke Mods="CTRL+SHIFT" Key="Right"/>
                    </Shortcut>

                    <Shortcut Name="PlayHeadFrameBack" ActionId="actions.timeline.FrameBack">
                        <KeyStroke Mods="ALT" Key="Left"/>
                    </Shortcut>
                    <Shortcut Name="PlayHeadFrameForward" ActionId="actions.timeline.FrameForward">
                        <KeyStroke Mods="ALT" Key="Right"/>
                    </Shortcut>
					
                    <Shortcut Name="NewTextClip" ActionId="actions.resources.newitem.NewText">
                        <KeyStroke Mods="CTRL" Key="T"/>
                    </Shortcut>
                </Group>
                <Group Name="TrackControllers">
                    <Shortcut Name="DeleteSelectedTrack" Description="Deletes the selected clip">
                        <KeyStroke Key="Delete"/>
                    </Shortcut>
                </Group>
                <Shortcut Name="NewVideoTrack" ActionId="actions.editor.NewVideoTrack" Description="Creates a new video clip">
                    <KeyStroke Mods="CTRL+SHIFT" Key="Q"/>
                </Shortcut>
                <Shortcut Name="NewAudioTrack" ActionId="actions.editor.NewAudioTrack" Description="Creates a new audio clip">
                    <KeyStroke Mods="CTRL" Key="Q"/>
                </Shortcut>
                <Shortcut Name="MoveSelectedTrackUp">
                    <KeyStroke Mods="CTRL+SHIFT" Key="NumPad8"/>
                </Shortcut>
                <Shortcut Name="MoveSelectedTrackDown">
                    <KeyStroke Mods="CTRL+SHIFT" Key="NumPad2"/>
                </Shortcut>
                <Shortcut Name="TogglePlayPause" ActionId="actions.editor.timeline.TogglePlayPause">
                    <KeyStroke Key="Space"/>
                </Shortcut>
                <Shortcut Name="AddKeyFrame" ActionId="actions.automation.AddKeyFrame" Description="Adds a new key frame at the play head at the playhead for the clip's or clip's active sequence">
                    <KeyStroke Key="K"/>
                </Shortcut>
            </Group>
        </Group>
    </Group>
</KeyMap>